{
  "schemaVersion": 1,
  "qualificationKind": "operationalQualification",
  "qualificationStatus": "QUALIFIED",
  "hosts": {
    "codex": {
      "hostId": "codex",
      "cliVersion": "codex-cli 0.145.0",
      "status": "QUALIFIED",
      "adapterLoadMode": "skill-md-explicit",
      "skillReadsVerified": true,
      "businessCommandsVerified": true,
      "scenarioCommandVerified": true,
      "unexpectedToolsDetected": false,
      "packageUnmodified": true,
      "inputsUnmodified": true,
      "unauthorizedWriteDetected": false,
      "absolutePathDetected": false,
      "scenarioDigest": "sha256:dda5f7bf8ec26f62ad159587774e3b2af99c08c9a775a5a34e8c8c4fce59697a",
      "toolEventsDigest": "sha256:13766e254d7073143f0380bb97ade00dcb55d8e9959da14f370f04e6b3dcc5f6"
    },
    "claude": {
      "hostId": "claude-code",
      "cliVersion": "2.1.220 (Claude Code)",
      "status": "QUALIFIED",
      "adapterLoadMode": "plugin-dir",
      "skillReadsVerified": true,
      "businessCommandsVerified": true,
      "scenarioCommandVerified": true,
      "unexpectedToolsDetected": false,
      "packageUnmodified": true,
      "inputsUnmodified": true,
      "unauthorizedWriteDetected": false,
      "absolutePathDetected": false,
      "scenarioDigest": "sha256:83ec71d955d0983d039f17541ebebaa6dcb653f09c12ca14cd928d821fbb7df2",
      "toolEventsDigest": "sha256:9faa1a1fe23f5b50e981d13f6afdca317dfff2c85f9715df3b3dfb30856a2d34"
    }
  },
  "trials": [
    {
      "hostId": "codex",
      "id": "help",
      "status": "PASS",
      "exitCode": 0,
      "code": "HELP_READY",
      "runLockReverified": false,
      "finding": null,
      "filesystemDelta": {
        "added": [],
        "removed": [],
        "modified": []
      },
      "inputDigestStable": null
    },
    {
      "hostId": "codex",
      "id": "author-no-binding",
      "status": "PASS",
      "exitCode": 1,
      "code": "NOT_ENABLED",
      "runLockReverified": false,
      "finding": null,
      "filesystemDelta": {
        "added": [],
        "removed": [],
        "modified": []
      },
      "inputDigestStable": null
    },
    {
      "hostId": "codex",
      "id": "review-no-binding",
      "status": "PASS",
      "exitCode": 1,
      "code": "NOT_ENABLED",
      "runLockReverified": false,
      "finding": null,
      "filesystemDelta": {
        "added": [],
        "removed": [],
        "modified": []
      },
      "inputDigestStable": null
    },
    {
      "hostId": "codex",
      "id": "repair-no-binding",
      "status": "PASS",
      "exitCode": 1,
      "code": "NOT_ENABLED",
      "runLockReverified": false,
      "finding": null,
      "filesystemDelta": {
        "added": [],
        "removed": [],
        "modified": []
      },
      "inputDigestStable": null
    },
    {
      "hostId": "codex",
      "id": "author",
      "status": "PASS",
      "exitCode": 0,
      "code": "AUTHOR_COMPLETE",
      "runLockReverified": true,
      "finding": null,
      "filesystemDelta": {
        "added": [
          "artifacts/e2e/authored.json",
          "artifacts/e2e/authored.matrix.json",
          "artifacts/e2e/authored.package.json"
        ],
        "removed": [],
        "modified": []
      },
      "inputDigestStable": null
    },
    {
      "hostId": "codex",
      "id": "review",
      "status": "PASS",
      "exitCode": 0,
      "code": "REVIEW_COMPLETE",
      "runLockReverified": true,
      "finding": {
        "rule": "E2E-F-005",
        "present": true
      },
      "filesystemDelta": {
        "added": [
          "reviews/oracle-review.json"
        ],
        "removed": [],
        "modified": []
      },
      "inputDigestStable": true
    },
    {
      "hostId": "codex",
      "id": "repair",
      "status": "PASS",
      "exitCode": 0,
      "code": "REPAIR_COMPLETE",
      "runLockReverified": true,
      "finding": {
        "rule": "E2E-F-005",
        "present": false
      },
      "filesystemDelta": {
        "added": [
          "artifacts/e2e/repaired.json"
        ],
        "removed": [],
        "modified": []
      },
      "inputDigestStable": null
    },
    {
      "hostId": "codex",
      "id": "re-review",
      "status": "PASS",
      "exitCode": 0,
      "code": "REVIEW_COMPLETE",
      "runLockReverified": true,
      "finding": {
        "rule": "E2E-F-005",
        "present": false
      },
      "filesystemDelta": {
        "added": [],
        "removed": [],
        "modified": []
      },
      "inputDigestStable": null
    },
    {
      "hostId": "codex",
      "id": "business-decision",
      "status": "PASS",
      "exitCode": 0,
      "code": "REPAIR_NEEDS_INPUT",
      "runLockReverified": true,
      "finding": null,
      "filesystemDelta": {
        "added": [],
        "removed": [],
        "modified": []
      },
      "inputDigestStable": null
    },
    {
      "hostId": "codex",
      "id": "bundle-drift",
      "status": "PASS",
      "exitCode": 1,
      "code": "BUNDLE_DIGEST_MISMATCH",
      "runLockReverified": false,
      "finding": null,
      "filesystemDelta": {
        "added": [],
        "removed": [],
        "modified": []
      },
      "inputDigestStable": null
    },
    {
      "hostId": "codex",
      "id": "host-swap",
      "status": "PASS",
      "exitCode": 1,
      "code": "HOST_MISMATCH",
      "runLockReverified": false,
      "finding": null,
      "filesystemDelta": {
        "added": [],
        "removed": [],
        "modified": []
      },
      "inputDigestStable": null
    },
    {
      "hostId": "codex",
      "id": "caller-lock",
      "status": "PASS",
      "exitCode": 1,
      "code": "CALLER_LOCK_REJECTED",
      "runLockReverified": false,
      "finding": null,
      "filesystemDelta": {
        "added": [],
        "removed": [],
        "modified": []
      },
      "inputDigestStable": null
    },
    {
      "hostId": "codex",
      "id": "default-write-reject",
      "status": "PASS",
      "exitCode": 1,
      "code": "METHOD_QUERY_REJECTED",
      "runLockReverified": false,
      "finding": null,
      "filesystemDelta": {
        "added": [],
        "removed": [],
        "modified": []
      },
      "inputDigestStable": null
    },
    {
      "hostId": "claude-code",
      "id": "help",
      "status": "PASS",
      "exitCode": 0,
      "code": "HELP_READY",
      "runLockReverified": false,
      "finding": null,
      "filesystemDelta": {
        "added": [],
        "removed": [],
        "modified": []
      },
      "inputDigestStable": null
    },
    {
      "hostId": "claude-code",
      "id": "author-no-binding",
      "status": "PASS",
      "exitCode": 1,
      "code": "NOT_ENABLED",
      "runLockReverified": false,
      "finding": null,
      "filesystemDelta": {
        "added": [],
        "removed": [],
        "modified": []
      },
      "inputDigestStable": null
    },
    {
      "hostId": "claude-code",
      "id": "review-no-binding",
      "status": "PASS",
      "exitCode": 1,
      "code": "NOT_ENABLED",
      "runLockReverified": false,
      "finding": null,
      "filesystemDelta": {
        "added": [],
        "removed": [],
        "modified": []
      },
      "inputDigestStable": null
    },
    {
      "hostId": "claude-code",
      "id": "repair-no-binding",
      "status": "PASS",
      "exitCode": 1,
      "code": "NOT_ENABLED",
      "runLockReverified": false,
      "finding": null,
      "filesystemDelta": {
        "added": [],
        "removed": [],
        "modified": []
      },
      "inputDigestStable": null
    },
    {
      "hostId": "claude-code",
      "id": "author",
      "status": "PASS",
      "exitCode": 0,
      "code": "AUTHOR_COMPLETE",
      "runLockReverified": true,
      "finding": null,
      "filesystemDelta": {
        "added": [
          "artifacts/e2e/authored.json",
          "artifacts/e2e/authored.matrix.json",
          "artifacts/e2e/authored.package.json"
        ],
        "removed": [],
        "modified": []
      },
      "inputDigestStable": null
    },
    {
      "hostId": "claude-code",
      "id": "review",
      "status": "PASS",
      "exitCode": 0,
      "code": "REVIEW_COMPLETE",
      "runLockReverified": true,
      "finding": {
        "rule": "E2E-F-005",
        "present": true
      },
      "filesystemDelta": {
        "added": [
          "reviews/oracle-review.json"
        ],
        "removed": [],
        "modified": []
      },
      "inputDigestStable": true
    },
    {
      "hostId": "claude-code",
      "id": "repair",
      "status": "PASS",
      "exitCode": 0,
      "code": "REPAIR_COMPLETE",
      "runLockReverified": true,
      "finding": {
        "rule": "E2E-F-005",
        "present": false
      },
      "filesystemDelta": {
        "added": [
          "artifacts/e2e/repaired.json"
        ],
        "removed": [],
        "modified": []
      },
      "inputDigestStable": null
    },
    {
      "hostId": "claude-code",
      "id": "re-review",
      "status": "PASS",
      "exitCode": 0,
      "code": "REVIEW_COMPLETE",
      "runLockReverified": true,
      "finding": {
        "rule": "E2E-F-005",
        "present": false
      },
      "filesystemDelta": {
        "added": [],
        "removed": [],
        "modified": []
      },
      "inputDigestStable": null
    },
    {
      "hostId": "claude-code",
      "id": "business-decision",
      "status": "PASS",
      "exitCode": 0,
      "code": "REPAIR_NEEDS_INPUT",
      "runLockReverified": true,
      "finding": null,
      "filesystemDelta": {
        "added": [],
        "removed": [],
        "modified": []
      },
      "inputDigestStable": null
    },
    {
      "hostId": "claude-code",
      "id": "bundle-drift",
      "status": "PASS",
      "exitCode": 1,
      "code": "BUNDLE_DIGEST_MISMATCH",
      "runLockReverified": false,
      "finding": null,
      "filesystemDelta": {
        "added": [],
        "removed": [],